{
  "schema_version": 1,
  "destinations": [
    {
      "id": "edimburgo",
      "status": "approved",
      "verified_at": "2026-10-28",
      "slug": "edimburgo",
      "name": "Edimburgo",
      "country_iso2": "GB",
      "summary_original": "Primera Ciudad de la Literatura de la UNESCO (2004), con museos de escritores y el monumento a Walter Scott."
    },
    {
      "id": "dublin",
      "status": "approved",
      "verified_at": "2026-10-28",
      "slug": "dublin",
      "name": "Dublín",
      "country_iso2": "IE",
      "summary_original": "Ciudad de la Literatura de la UNESCO desde 2010 y escenario del Ulises de Joyce."
    },
    {
      "id": "madrid-barrio-de-las-letras",
      "status": "approved",
      "verified_at": "2026-10-28",
      "slug": "madrid-barrio-de-las-letras",
      "name": "Madrid",
      "country_iso2": "ES",
      "summary_original": "El Barrio de las Letras reúne la casa de Lope de Vega, el convento donde descansa Cervantes y la Biblioteca Nacional."
    },
    {
      "id": "barcelona",
      "status": "approved",
      "verified_at": "2026-10-28",
      "slug": "barcelona",
      "name": "Barcelona",
      "country_iso2": "ES",
      "summary_original": "Ciudad de la Literatura de la UNESCO desde 2015 y sede de Sant Jordi, el día del libro y la rosa."
    },
    {
      "id": "oxford",
      "status": "approved",
      "verified_at": "2026-10-28",
      "slug": "oxford",
      "name": "Oxford",
      "country_iso2": "GB",
      "summary_original": "Ciudad universitaria de la Bodleian, la Radcliffe Camera y los Inklings de Tolkien y Lewis."
    },
    {
      "id": "praga",
      "status": "approved",
      "verified_at": "2026-10-28",
      "slug": "praga",
      "name": "Praga",
      "country_iso2": "CZ",
      "summary_original": "Ciudad de Franz Kafka y de bibliotecas barrocas como la de Strahov y la del Klementinum."
    },
    {
      "id": "lisboa",
      "status": "approved",
      "verified_at": "2026-10-28",
      "slug": "lisboa",
      "name": "Lisboa",
      "country_iso2": "PT",
      "summary_original": "Ciudad de Fernando Pessoa y de la Livraria Bertrand, la librería en funcionamiento más antigua del mundo."
    },
    {
      "id": "paris",
      "status": "approved",
      "verified_at": "2026-10-28",
      "slug": "paris",
      "name": "París",
      "country_iso2": "FR",
      "summary_original": "Ciudad de la historia de Shakespeare and Company, la librería que publicó el Ulises."
    },
    {
      "id": "coimbra",
      "status": "approved",
      "verified_at": "2026-10-28",
      "slug": "coimbra",
      "name": "Coímbra",
      "country_iso2": "PT",
      "summary_original": "Ciudad universitaria portuguesa con la Biblioteca Joanina barroca."
    },
    {
      "id": "oporto",
      "status": "approved",
      "verified_at": "2026-10-28",
      "slug": "oporto",
      "name": "Oporto",
      "country_iso2": "PT",
      "summary_original": "Ciudad portuguesa de la Livraria Lello, de 1906."
    },
    {
      "id": "buenos-aires",
      "status": "approved",
      "verified_at": "2026-10-28",
      "slug": "buenos-aires",
      "name": "Buenos Aires",
      "country_iso2": "AR",
      "summary_original": "Capital argentina de El Ateneo Grand Splendid, una librería instalada en un teatro de 1919."
    },
    {
      "id": "haworth",
      "status": "approved",
      "verified_at": "2026-10-28",
      "slug": "haworth",
      "name": "Haworth",
      "country_iso2": "GB",
      "summary_original": "Pueblo de Yorkshire donde vivió la familia Brontë."
    },
    {
      "id": "alejandria",
      "status": "approved",
      "verified_at": "2026-10-28",
      "slug": "alejandria",
      "name": "Alejandría",
      "country_iso2": "EG",
      "summary_original": "Ciudad egipcia de la antigua Biblioteca de Alejandría y de la Bibliotheca Alexandrina actual."
    },
    {
      "id": "la-mancha",
      "status": "approved",
      "verified_at": "2026-10-28",
      "slug": "la-mancha",
      "name": "La Mancha",
      "country_iso2": "ES",
      "summary_original": "Comarca de Castilla-La Mancha asociada al Quijote y atravesada por la Ruta de Don Quijote."
    }
  ],
  "places": [
    {
      "id": "biblioteca-trinity-college-dublin",
      "status": "approved",
      "verified_at": "2026-10-28",
      "slug": "biblioteca-trinity-college-dublin",
      "name": "Biblioteca de Trinity College y Long Room",
      "destination_id": "dublin",
      "place_type": "library",
      "geo_precision": "city",
      "summary_original": "El Long Room de Trinity College, en Dublín, guarda el Libro de Kells. Qué es hecho verificable y qué comparaciones con el cine no están confirmadas.",
      "official_url": "https://www.tcd.ie/library/",
      "visit_status": "reservation",
      "source_ids": [
        "tcd-ie-library",
        "bookofkells-ie"
      ]
    },
    {
      "id": "biblioteca-strahov-praga",
      "status": "approved",
      "verified_at": "2026-10-28",
      "slug": "biblioteca-strahov-praga",
      "name": "Biblioteca de Strahov",
      "destination_id": "praga",
      "place_type": "library",
      "geo_precision": "city",
      "summary_original": "La biblioteca del monasterio de Strahov, en Praga, tiene dos salas históricas barrocas y neoclásicas. Qué se puede ver y cómo se visita.",
      "official_url": "https://www.strahovskyklaster.cz/en",
      "visit_status": "outside",
      "source_ids": [
        "strahovskyklaster-cz-en"
      ]
    },
    {
      "id": "shakespeare-and-company-paris",
      "status": "approved",
      "verified_at": "2026-10-28",
      "slug": "shakespeare-and-company-paris",
      "name": "Shakespeare and Company",
      "destination_id": "paris",
      "place_type": "bookshop",
      "geo_precision": "city",
      "summary_original": "La librería Shakespeare and Company de París no es la original de Sylvia Beach. La historia real de dos librerías con el mismo nombre.",
      "official_url": "https://shakespeareandcompany.com/",
      "visit_status": "visit_inside",
      "source_ids": [
        "shakespeareandcompany-com"
      ]
    },
    {
      "id": "biblioteca-joanina-coimbra",
      "status": "approved",
      "verified_at": "2026-10-28",
      "slug": "biblioteca-joanina-coimbra",
      "name": "Biblioteca Joanina",
      "destination_id": "coimbra",
      "place_type": "library",
      "geo_precision": "city",
      "summary_original": "La Biblioteca Joanina de la Universidad de Coímbra es una biblioteca barroca del siglo XVIII. Qué se sabe y cómo se visita.",
      "official_url": "https://www.uc.pt/",
      "visit_status": "reservation",
      "source_ids": [
        "whc-unesco-org-en-list-1387",
        "uc-pt"
      ]
    },
    {
      "id": "livraria-lello-porto",
      "status": "approved",
      "verified_at": "2026-10-28",
      "slug": "livraria-lello-porto",
      "name": "Livraria Lello",
      "destination_id": "oporto",
      "place_type": "bookshop",
      "geo_precision": "city",
      "summary_original": "La Livraria Lello de Oporto es una librería neogótica de 1906. Qué se sabe de su historia y por qué su vínculo con Harry Potter no está confirmado.",
      "official_url": "https://www.livrarialello.pt/",
      "visit_status": "reservation",
      "source_ids": [
        "livrarialello-pt"
      ]
    },
    {
      "id": "el-ateneo-grand-splendid-buenos-aires",
      "status": "approved",
      "verified_at": "2026-10-28",
      "slug": "el-ateneo-grand-splendid-buenos-aires",
      "name": "El Ateneo Grand Splendid",
      "destination_id": "buenos-aires",
      "place_type": "bookshop",
      "geo_precision": "city",
      "summary_original": "El Ateneo Grand Splendid es una librería de Buenos Aires instalada en un antiguo teatro de 1919. Su historia y qué se puede visitar.",
      "visit_status": "visit_inside",
      "source_ids": [
        "turismo-buenosaires-gob-ar"
      ]
    },
    {
      "id": "bronte-parsonage-haworth",
      "status": "approved",
      "verified_at": "2026-10-28",
      "slug": "bronte-parsonage-haworth",
      "name": "Casa parroquial de las Brontë",
      "destination_id": "haworth",
      "place_type": "writer_house_museum",
      "geo_precision": "city",
      "summary_original": "La casa parroquial de Haworth, en Yorkshire, fue el hogar de la familia Brontë. Hoy es un museo. Qué se sabe y qué se imagina de sus novelas.",
      "official_url": "https://www.bronte.org.uk/",
      "visit_status": "visit_inside",
      "source_ids": [
        "bronte-org-uk"
      ]
    },
    {
      "id": "biblioteca-de-alejandria",
      "status": "approved",
      "verified_at": "2026-10-28",
      "slug": "biblioteca-de-alejandria",
      "name": "Biblioteca de Alejandría (antigua y actual)",
      "destination_id": "alejandria",
      "place_type": "library",
      "geo_precision": "city",
      "summary_original": "La Biblioteca de Alejandría existió y fue enorme, pero no la destruyó un único incendio. Qué es historia documentada y qué es leyenda, y la biblioteca actual.",
      "official_url": "https://www.bibalex.org/",
      "visit_status": "visit_inside",
      "source_ids": [
        "bibalex-org"
      ]
    },
    {
      "id": "museo-de-los-escritores-edimburgo",
      "status": "approved",
      "verified_at": "2026-10-28",
      "slug": "museo-de-los-escritores-edimburgo",
      "name": "Museo de los Escritores",
      "destination_id": "edimburgo",
      "place_type": "museum",
      "geo_precision": "city",
      "summary_original": "Museo en Lady Stair's House dedicado a Robert Burns, Walter Scott y Robert Louis Stevenson.",
      "official_url": "https://www.edinburghmuseums.org.uk/venue/writers-museum",
      "visit_status": "visit_inside",
      "source_ids": [
        "edinburghmuseums-org-uk-venue-writers-museum"
      ]
    },
    {
      "id": "monumento-a-walter-scott-edimburgo",
      "status": "approved",
      "verified_at": "2026-10-28",